{
  "schema_version": "2.3.0",
  "document_type": "TYMM_TEACHER_GUIDE_BOOK_MIRROR",
  "course_id": "TDE_11",
  "theme_id": "TEMA_03",
  "scope": {"printed_page_range": "210-214", "status": "REVIEW_REQUIRED"},
  "source_policy": {
    "primary_source": "official_textbook_pdf",
    "prompt_modes": ["VERBATIM_SHORT", "VERIFIED_SUMMARY", "LOCATOR_ONLY"],
    "locator_only_policy": "QUESTION öğelerinde LOCATOR_ONLY normal davranış değildir; resmî PDF'den doğrulanmış kısa soru tanımı gerekir."
  },
  "guide_principles": [
    "Konuşma atölyesi s.210-214 resmî ders kitabındaki soru, performans, içerik ve değerlendirme sırasını korur.",
    "Hayalî mülakat cevapları Huzur kişisinin romandaki söz, davranış, ilişki ve değerlerinden türetilir; karaktere kaynakta olmayan kesin biyografik ayrıntılar yüklenmez.",
    "Planlama, içerik oluşturma ve uygulama listeleri yapay biçimde ayrı kartlara parçalanmaz; öğretmen kitabın doğal süreç bloklarını görür.",
    "PDF'de yalnız QR yönlendirmesi görülen dereceli puanlama anahtarı ve akran formunun görünmeyen maddeleri/düzeyleri üretilmez.",
    "Öz değerlendirmede Evet/Kısmen/Hayır seçimi bir sonuca değil, sonraki konuşma için somut gelişim hedefi belirlemeye bağlanır."
  ],
  "entries": [
    {
      "mirror_id": "T3V23_P210_Q01",
      "section_id": "T3_SEC_03_KONUSMA_MULAKAT",
      "unit_id": "T3_GUIDE_U09_KONUSMA_YONETIM",
      "printed_page_range": "210",
      "book_heading": "Konuşmayı Yönetebilme — Kemal Tahir mülakatı",
      "presentation_type": "QUESTION",
      "canonical_item_refs": ["T3_G09_P210_Q1_2"],
      "answer_keys": ["1"],
      "prompt_display": "Soru 1 — Kemal Tahir ile yapılan mülakatın amacı ne olabilir?",
      "prompt_mode": "VERBATIM_SHORT",
      "teacher_note": "‘Yazar hakkında bilgi almak’ cevabını somutlaştırın: roman konusu/kişisi, çalışma yöntemi ve Türkçe hakkındaki görüşleri doğrudan yazardan öğrenme işlevini fark ettirin.",
      "show_acceptance": true,
      "rights_mode": "LIMITED_QUOTATION",
      "source_locator": "basılı s.210 / PDF s.211 — soru 1"
    },
    {
      "mirror_id": "T3V23_P210_Q02",
      "section_id": "T3_SEC_03_KONUSMA_MULAKAT",
      "unit_id": "T3_GUIDE_U09_KONUSMA_YONETIM",
      "printed_page_range": "210",
      "book_heading": "Konuşmayı Yönetebilme — Kemal Tahir mülakatı",
      "presentation_type": "QUESTION",
      "canonical_item_refs": ["T3_G09_P210_Q1_2"],
      "answer_keys": ["2"],
      "prompt_display": "Soru 2 — Soruların, sürenin ve hedef kitlenin önceden belirlenmesi mülakatı nasıl etkiler?",
      "prompt_mode": "VERIFIED_SUMMARY",
      "teacher_note": "Planlamanın yalnız ‘düzen sağlar’ sonucunda kalmamasını isteyin: soru niteliği, odak, süre yönetimi ve dinleyiciye uygunluk etkilerini ayrı ayrı düşündürün.",
      "show_acceptance": true,
      "rights_mode": "DERIVED_ACTIVITY",
      "source_locator": "basılı s.210 / PDF s.211 — soru 2"
    },
    {
      "mirror_id": "T3V23_P211_MULAKAT_PLAN",
      "section_id": "T3_SEC_03_KONUSMA_MULAKAT",
      "unit_id": "T3_GUIDE_U09_KONUSMA_YONETIM",
      "printed_page_range": "211",
      "book_heading": "Performans Görevi — Huzur kişisiyle hayalî mülakat",
      "presentation_type": "PROCESS",
      "canonical_item_refs": ["T3_G09_P211_PERFORMANS"],
      "teacher_note": "Önce karakter seçimini gerekçelendirin, sonra amaç-hedef kitle-strateji planına geçin. Çalışma kâğıdındaki kişi özellikleri, daha sonra üretilecek cevapların ‘karaktere uygunluk’ kontrol listesi olarak kullanılsın.",
      "show_acceptance": true,
      "rights_mode": "DERIVED_ACTIVITY",
      "source_locator": "basılı s.211 / PDF s.212 — Performans Görevi 1-3 ve Çalışma Kâğıdı"
    },
    {
      "mirror_id": "T3V23_P212_MULAKAT_ICERIK",
      "section_id": "T3_SEC_03_KONUSMA_MULAKAT",
      "unit_id": "T3_GUIDE_U10_KONUSMA_ICERIK",
      "printed_page_range": "212",
      "book_heading": "İçerik Oluşturabilme — mülakat soru/cevap ve taslak geliştirme",
      "presentation_type": "PROCESS",
      "canonical_item_refs": ["T3_G10_P212_SORU_CEVAP"],
      "teacher_note": "Soru seçimini ‘en ilginç soru’ oylamasına çevirmeyin. Her aday soruyu roman kişisini açığa çıkarma, Huzur bağlamıyla uyum ve hedef kitleye katkı bakımından tarttırın; cevaplarda karakterin dili/beden dili için romanda kanıt arayın.",
      "show_acceptance": true,
      "rights_mode": "DERIVED_ACTIVITY",
      "source_locator": "basılı s.212 / PDF s.213 — Düşünelim Paylaşalım 1-6 ve mülakat taslağı a-h"
    },
    {
      "mirror_id": "T3V23_P213_MULAKAT_UYGULAMA",
      "section_id": "T3_SEC_03_KONUSMA_MULAKAT",
      "unit_id": "T3_GUIDE_U11_KONUSMA_UYGULAMA",
      "printed_page_range": "213",
      "book_heading": "Kural Uygulayabilme — hayalî mülakatı gerçekleştirme",
      "presentation_type": "PROCESS",
      "canonical_item_refs": ["T3_G11_P213_PERFORMANS"],
      "teacher_note": "Uygulamada iki ayrı şeyi gözleyin: konuşmacının gerçek performansı (akıcılık, diksiyon, beden dili, bağdaşıklık) ve hayalî karakter cevabının Huzur bağlamına uygunluğu. Birindeki eksikliği diğerinin yerine puanlamayın.",
      "show_acceptance": true,
      "rights_mode": "DERIVED_ACTIVITY",
      "source_locator": "basılı s.213 / PDF s.214 — Kural Uygulayabilme a-j"
    },
    {
      "mirror_id": "T3V23_P214_Q01_ILETI",
      "section_id": "T3_SEC_03_KONUSMA_MULAKAT",
      "unit_id": "T3_GUIDE_U12_KONUSMA_DEGERLENDIRME",
      "printed_page_range": "214",
      "book_heading": "Süreci Değerlendirebilme — açık ve örtük iletiler",
      "presentation_type": "QUESTION",
      "canonical_item_refs": ["T3_G12_P214_QR_RUBRIK"],
      "answer_keys": ["q1_ileti_degerlendirme"],
      "prompt_display": "Soru 1 — Hayalî mülakattaki roman kişisinin verebileceği cevaplardan hareketle açık ve örtük iletileri değerlendiriniz.",
      "prompt_mode": "VERIFIED_SUMMARY",
      "teacher_note": "Öğrenciden yalnız iletiyi adlandırmasını değil, o iletinin Huzur'daki hangi söz/davranış/ilişkiden türetildiğini göstermesini isteyin.",
      "rights_mode": "DERIVED_ACTIVITY",
      "source_locator": "basılı s.214 / PDF s.215 — Değerlendirme soru 1"
    },
    {
      "mirror_id": "T3V23_P214_Q02_DAYANAK",
      "section_id": "T3_SEC_03_KONUSMA_MULAKAT",
      "unit_id": "T3_GUIDE_U12_KONUSMA_DEGERLENDIRME",
      "printed_page_range": "214",
      "book_heading": "Süreci Değerlendirebilme — karakter yargılarının dayanağı",
      "presentation_type": "QUESTION",
      "canonical_item_refs": ["T3_G12_P214_QR_RUBRIK"],
      "answer_keys": ["q2_yargi_dayanagi"],
      "prompt_display": "Soru 2 — Roman kişileri hakkında ulaştığınız yargı ve bilgilerin dayanaklarını gerekçeli biçimde açıklayınız.",
      "prompt_mode": "VERIFIED_SUMMARY",
      "teacher_note": "Hayalî mülakat kurmaca genişletme yapabilir; fakat yeni ayrıntı karakterin romandaki özelliğiyle çelişiyorsa bunu ‘yaratıcılık’ diye kabul etmeyin.",
      "rights_mode": "DERIVED_ACTIVITY",
      "source_locator": "basılı s.214 / PDF s.215 — Değerlendirme soru 2"
    },
    {
      "mirror_id": "T3V23_P214_DEGER_3_7",
      "section_id": "T3_SEC_03_KONUSMA_MULAKAT",
      "unit_id": "T3_GUIDE_U12_KONUSMA_DEGERLENDIRME",
      "printed_page_range": "214",
      "book_heading": "Süreci Değerlendirebilme — rubrik, öz değerlendirme, gelişim ve akran geri bildirimi",
      "presentation_type": "ASSESSMENT",
      "canonical_item_refs": ["T3_G12_P214_OZ_DEGER"],
      "teacher_note": "Kitap sayfasında görünen altı öz değerlendirme ölçütünü kullanın. ‘Kısmen/Hayır’ işaretlenen her ölçütten bir sonraki konuşma için tek somut gelişim hedefi çıkarın. Dereceli Puanlama Anahtarı ve Akran Değerlendirme Formu QR içeriği PDF'ye gömülü değildir; görünmeyen madde/düzeyleri üretmeyin.",
      "show_acceptance": true,
      "rights_mode": "PAGE_REFERENCE",
      "source_locator": "basılı s.214 / PDF s.215 — Değerlendirme 3-7, Öz Değerlendirme Formu ve QR yönlendirmeleri"
    }
  ],
  "page_checklist": [
    {"printed_page_range": "210", "check": "Kemal Tahir mülakatındaki iki soru ayrı ve tanınabilir mi; amaç ile planlamanın etkisi birbirinden ayrılıyor mu?"},
    {"printed_page_range": "211", "check": "Karakter seçimi, karakter özellikleri, amaç-hedef kitle-strateji planı tek performans akışı içinde görünür mü?"},
    {"printed_page_range": "212", "check": "Sorular roman kişisini açığa çıkarma ve Huzur kanıtına uygunlukla seçiliyor; karakter dili/beden dili kaynakta görülen özelliklerden türetiliyor mu?"},
    {"printed_page_range": "213", "check": "Gerçek konuşma performansı ile hayalî karaktere uygunluk iki ayrı gözlem odağı olarak değerlendiriliyor mu?"},
    {"printed_page_range": "214", "check": "Değerlendirme 1-2 ayrı soru kartı; 3-7 doğal değerlendirme akışı; altı görünen öz değerlendirme ölçütü kullanılıyor ve görünmeyen QR rubrik/akran maddeleri üretilmiyor mu?"}
  ]
}
